{
  "$schema": "https://json-schema.org/draft/2020-12/schema",
  "type": "array",
  "minItems": 5,
  "maxItems": 5,
  "items": {
    "type": "object",
    "properties": {
      "property_id": {
        "type": "string",
        "minLength": 1
      },
      "address": {
        "type": "string",
        "minLength": 1
      },
      "city": {
        "type": "string",
        "minLength": 1
      },
      "state": {
        "type": "string",
        "minLength": 2,
        "maxLength": 2
      },
      "zip_code": {
        "type": "string",
        "pattern": "^[0-9]{5}(-[0-9]{4})?$"
      },
      "price": {
        "type": "number",
        "minimum": 0
      },
      "bedrooms": {
        "type": "integer",
        "minimum": 0
      },
      "bathrooms": {
        "type": "number",
        "minimum": 0
      },
      "square_feet": {
        "type": "integer",
        "minimum": 0
      },
      "amenities": {
        "type": "array",
        "items": {
          "type": "string",
          "minLength": 1
        },
        "uniqueItems": true
      },
      "local_sponsors": {
        "type": "array",
        "items": {
          "type": "object",
          "properties": {
            "sponsor_id": {
              "type": "string",
              "minLength": 1
            },
            "name": {
              "type": "string",
              "minLength": 1
            },
            "target_url": {
              "type": "string",
              "format": "uri"
            }
          },
          "required": [
            "sponsor_id",
            "name",
            "target_url"
          ],
          "additionalProperties": false
        }
      }
    },
    "required": [
      "property_id",
      "address",
      "city",
      "state",
      "zip_code",
      "price",
      "bedrooms",
      "bathrooms",
      "square_feet",
      "amenities",
      "local_sponsors"
    ],
    "additionalProperties": false
  }
}
